Source,Target,Title,Year,Rhetorics,
BasePaper,2012_27_5,A formal relation between the h-index of a set of articles and their I3 score,2012,Puse,neutral
BasePaper,2012_14_1,"Remarks on the paper by A. De Visscher,“what does the g?index really measure?”",2012,Puse,positive
BasePaper,2012_17_1,Stem cell and tissue engineering research in the Islamic Republic of Iran,2012,Puse,negative
BasePaper,2012_53_7,"How Should Journal Quality be Ranked? An Application to Agricultural, Energy, Environmental and Resource Economics",2012,Puse,positive
BasePaper,2012_19_3,"Characterizing the frequency of repeated citations: The effects of journal, subject area, and self-citation",2012,Puse,positive
BasePaper,2012_6_7,Scholarometer: A social framework for analyzing impact across disciplines,2012,Puse,positive
BasePaper,2012_15_10,Bibliometric analysis of CiteSeer data for countries,2012,Puse,neutral
BasePaper,2012_14_8,"Department of Veterans Affairs Geriatric Research, Education and Clinical Centers: translating aging research into clinical geriatrics",2012,Puse,positive
BasePaper,2012_48_4,A tapered diffusion impact indicator: A preliminary exploration on the journal level,2012,Puse,positive
BasePaper,2012_58_10,Pulmonale Hypertonie,2012,Puse,positive
BasePaper,2012_35_9,"The h b-index, a modified h-index designed to more fairly assess author achievement",2012,Puse,positive
BasePaper,2012_6_9,"Google Scholar Author Citation Tracker: is it too little, too late?",2012,Puse,positive
BasePaper,2012_8_4,Confidence intervals for the probability of superiority effect size measure and the area under a receiver operating characteristic curve,2012,Puse,neutral
BasePaper,2012_48_8,"Academic Research Journals in Medical Sociology, Medical Anthropology, and Contemporary Social Medicine: A Focus on Public and Global Health",2012,Puse,positive
BasePaper,2012_35_7,Characteristics of bibliometrics articles in library and information sciences (LIS) and other journals,2012,Puse,positive
BasePaper,2012_16_6,The evaluation of citation distributions,2012,Puse,positive
BasePaper,2012_52_2,What Data Sources and Bibliometric Indicators for Social Sciences? Some Results from a Case Study,2012,Puse,neutral
BasePaper,2012_34_10,Good news for the people who love bad news: an analysis of the funding of the top 1% most highly cited ecologists,2012,Puse,positive
BasePaper,2012_54_6,Ranking Journal Quality by Harmonic Mean of Ranks: An Application to ISI Statistics & Probability,2012,Puse,positive
BasePaper,2012_26_1,Does academic output correlate with better mortality rates in NHS trusts in England?,2012,Puse,positive
BasePaper,2012_41_5,Bibliographic analysis of papers and authors published in Tobacco Control 1998–September 2011,2012,Puse,positive
BasePaper,2012_62_1,The assessment of productivity in research in Physical Education: reflections on some limitations of bibliometric indicators,2012,Puse,positive
BasePaper,2012_12_3,New indexes for compound prioritization and complexity quantification on environmental monitoring inventories,2012,Puse,positive
BasePaper,2012_10_4,Ranking of research output of universities on the basis of the multidimensional prestige of influential fields: Spanish universities as a case of study,2012,Puse,positive
BasePaper,2012_9_2,Country comparisons of human stroke research since 2001,2012,Puse,positive
BasePaper,2012_7_4,Statistical analysis of the Hirsch Index,2012,Puse,positive
BasePaper,2012_34_3,Research in Business Process Management: A bibliometric analysis,2012,Puse,positive
BasePaper,2012_54_1,Journal of Informetrics,2012,Puse,positive
BasePaper,2012_50_5,A critical analysis and strategic framework for research in sport and exercise medicine at the University of the Free State,2012,Puse,positive
BasePaper,2012_55_4,Scholarly influence research (SIR): Augmenting ideational influence with social influence,2012,Puse,neutral
BasePaper,2012_46_2,Scienceography: the study of how science is written,2012,Puse,neutral
BasePaper,2012_20_4,"Identification and bibliometric characterization of research groups in the cardio-cerebrovascular field, Spain 1996-2004",2012,Puse,positive
BasePaper,2012_25_10,Metrics of scholarly impact,2012,Puse,positive
BasePaper,2012_47_7,KIER DISCUSSION PAPER SERIES,2012,Puse,positive
BasePaper,2012_22_6,Assessing international journal impact: the case of marketing,2012,Puse,neutral
BasePaper,2012_3_4,Quantifying the influence of scientists and their publications: distinguishing between prestige and popularity,2012,Puse,positive
BasePaper,2012_52_6,The Italian Reform of the academic recruitment system. An appraisal of ANVUR and CUN benchmarks for assessing candidates and commissioners,2012,Puse,neutral
BasePaper,2012_20_8,PAV: A novel model for ranking heterogeneous objects in bibliographic information networks,2012,Puse,negative
BasePaper,2012_13_3,Two h-index benchmarks for evaluating the publication performance of medical informatics researchers,2012,Puse,negative
BasePaper,2012_42_9,Topic Based Author Ranking with Full-Text Citation Analysis,2012,Puse,positive
BasePaper,2012_50_6,Confessions of a Dean,2012,Puse,positive
BasePaper,2012_10_9,Partition-based field normalization: An approach to highly specialized publication records,2012,Puse,negative
BasePaper,2012_53_6,2D Lee Claim Index: User Count Index for Quality & Finer H-Index for Quantity,2012,Puse,positive
BasePaper,2012_46_6,Research: Quantity vs quality vs impact (bronze vs silver vs gold),2012,Puse,positive
BasePaper,2012_3_8,Open evaluation: a vision for entirely transparent post-publication peer review and rating for science,2012,Puse,positive
BasePaper,2012_45_8,Academic Ranking with Web Mining and Axiomatic Analysis,2012,Puse,positive
BasePaper,2012_47_3,Quantitative assessment of scientific quality,2012,Puse,positive
BasePaper,2012_5_2,Identifying trustworthy experts: how do policymakers find and assess public health researchers worth consulting or collaborating with?,2012,Puse,positive
BasePaper,2012_29_2,Academic Research Performance and Intellectual Capital Measurement System: Evidence from Italian Universities,2012,Puse,neutral
BasePaper,2012_3_5,Citation-based metrics are appropriate tools in journal assessment provided that they are accurate and used in an informed way,2012,Puse,positive
BasePaper,2012_26_7,Intellectual influence: Quality versus quantity,2012,Puse,positive
BasePaper,2012_2_3,An integrated approach for main path analysis: Development of the Hirsch index as an example,2012,Puse,negative
BasePaper,2012_21_8,Visual exploration of collaboration networks based on graph degeneracy,2012,Puse,positive
BasePaper,2012_11_4,Designing next-generation platforms for evaluating scientific output: what scientists can learn from the social web,2012,Puse,positive
BasePaper,2012_35_6,Towards knowledge based impact metrics for open source research publications,2012,Puse,negative
BasePaper,2012_18_9,"Key Issue-Scientometrics, bibliometrics, altmetrics: some introductory advice for the lost and bemused",2012,Puse,positive
BasePaper,2012_6_3,Measuring scholarly impact using modern citation-based indices,2012,Puse,positive
BasePaper,2012_41_2,Topic-centric recommender systems for bibliographic datasets,2012,Puse,neutral
BasePaper,2012_10_10,"On the relationship between citations of publication output and Hirsch index h of authors: Conceptualization of tapered Hirsch index h T, circular citation area radius R  …",2012,Puse,neutral
BasePaper,2012_28_1,A two?dimensional approach to performance evaluation for a large number of research institutions,2012,Puse,neutral
BasePaper,2012_23_5,Scientific Collaboration in Research Networks: A Quantification Method by Using Gini Coefficient.,2012,Puse,positive
BasePaper,2012_25_4,Brazilian scientific journals that use the Open Journal Systems (OJS): a quality analysis,2012,Puse,positive
BasePaper,2012_42_4,Quasi% convex Risk Measures and Acceptability Indices. Theory and Applications.,2012,Puse,neutral
BasePaper,2012_3_7,Citations and impact of ISI tourism and hospitality journals,2012,Puse,positive
BasePaper,2012_28_3,"Lies, damned lies and h-indices",2012,Puse,positive
BasePaper,2012_47_6,The h Index for Management Information Systems,2012,Puse,positive
BasePaper,2012_22_4,A linear ordering of a multi-parameter universe is usually nonsense,2012,Puse,neutral
BasePaper,2012_19_5,How Nobel Laureates Would Perform in the Handelsblatt Ranking,2012,Puse,positive
BasePaper,2012_20_9,Comparing paper ranking algorithms,2012,Puse,positive
BasePaper,2012_16_9,How to select a journal to submit and publish your biomedical paper?,2012,Puse,positive
BasePaper,2012_42_7,Science Librarians Analysis of the 2011 Nobel Prize in Chemistry: The Work of Dan Shechtman,2012,Puse,neutral
BasePaper,2012_58_4, A Study on Patent Indexes for Characteristics Analysis of IP Portfolios,2012,Puse,positive
BasePaper,2012_49_6,What do Experts Know About Ranking Journal Quality? A Comparison with ISI Research Impact in Finance,2012,Puse,positive
BasePaper,2012_48_5,Florida State University Libraries,2012,Puse,negative
BasePaper,2012_13_2,An extension of the h index that covers the tail and the top of the citation curve and allows ranking researchers with similar h,2012,Puse,positive
BasePaper,2012_19_4,Prolific scholarship in communication studies: Five years in review,2012,Puse,positive
BasePaper,2012_27_9,A Bibliometrics Analysis of Canadian Electrical and Computer Engineering Institutions (1996-2006) Based on IEEE Journal Publications,2012,Puse,neutral
BasePaper,2012_2_5,Scholarly impact revisited,2012,Puse,positive
BasePaper,2012_22_9,"Coverage of business administration literature in Google Scholar: Analysis and comparison with EconBiz, Scopus and Web of Science",2012,Puse,positive
BasePaper,2012_53_3,Decomposition of the h-index,2012,Puse,neutral
BasePaper,2012_20_1,Scienceography: the study of how science is written,2012,Puse,neutral
BasePaper,2012_11_2,Identifying the “players” in sports analytics research,2012,Puse,positive
BasePaper,2012_11_5,Ten challenges in modeling bibliographic data for bibliometric analysis,2012,Puse,positive
BasePaper,2012_54_9,The Journal's Integrated Impact Index a new indicator for journal evaluation,2012,Puse,positive
BasePaper,2012_13_6,Exploring the h-index at the institutional level: A practical application in world university rankings,2012,Puse,positive
BasePaper,2012_50_2,Robust Ranking of Journal Quality: An Application to Economics,2012,Puse,positive
BasePaper,2012_15_9,Is primatology an equal-opportunity discipline?,2012,Puse,positive
BasePaper,2012_48_6,Citation impact discerning self-citation: improving user interaction,2012,Puse,positive
BasePaper,2012_13_4,Evaluation of ninety-three major Greek university departments using Google Scholar,2012,Puse,positive
BasePaper,2012_35_3,Is Hirsch's H the Best Predictor of the Number of a Researcher's Extremely Highly Cited Articles?,2012,Puse,positive
BasePaper,2012_26_3,Shapley values for assessing research production and impact of schools and scholars,2012,Puse,positive
BasePaper,2012_20_7,A comparison of top economics departments in the US and EU on the basis of the multidimensional prestige of influential articles in 2010,2012,Puse,positive
BasePaper,2012_8_6,Exploring the directed h-degree in directed weighted networks,2012,Puse,negative
BasePaper,2012_1_7,"Transparency, quality and accountability",2012,Puse,positive
BasePaper,2012_9_5,Metrics to evaluate research performance in academic institutions: a critique of ERA 2010 as applied in forestry and the indirect H2 index as a possible alternative,2012,Puse,positive
BasePaper,2012_11_3,Learning from open source software projects to improve scientific review,2012,Puse,positive
BasePaper,2012_3_1,Citation prediction in heterogeneous bibliographic networks,2012,Puse,positive
BasePaper,2012_19_6,"Laryngeal cancer: Quantitative and qualitative assessment of research output, 1945–2010",2012,Puse,positive
BasePaper,2012_46_1,European Analytical Column No. 40 by the Division of Analytical Chemistry (DAC) of the European Association for Chemical and Molecular Sciences (EuCheMS),2012,Puse,positive
BasePaper,2012_3_6,"Exploratory factor analysis for the Hirsch index, 17 h-type variants, and some traditional bibliometric indicators",2012,Puse,positive
BasePaper,2012_4_9,To better stand on the shoulder of giants,2012,Puse,neutral
BasePaper,2012_5_4,The relationships between the patent performance and corporation performance,2012,Puse,neutral
BasePaper,2012_6_6,"Bounds and inequalities relating h-index, g-index, e-index and generalized impact factor: an improvement over existing models",2012,Puse,neutral
BasePaper,2012_62_6,"Modelo de gestión de documentos docentes en un centro universitario, basado en hipervínculos",2012,Puse,positive
BasePaper,2012_47_1,Journal Impact factor What would recommend to get the Impact Factor for a journal?,2012,Puse,positive
BasePaper,2012_9_4,Future publication success in science is better predicted by traditional measures than by the h index,2012,Puse,positive
BasePaper,2012_11_7,Benchmarking individual publication productivity in logistics,2012,Puse,negative
BasePaper,2012_34_4,Italian Reform of the academic recruitment system. An appraisal of ANVUR and CUN benchmarks for assessing candidates and commissioners,2012,Puse,neutral
BasePaper,2012_8_2,Indicators for research performance evaluation: an overview,2012,Puse,positive
BasePaper,2012_1_9,"Diversity, value and limitations of the journal impact factor and alternative metrics",2012,Puse,negative
BasePaper,2012_49_8,Indices to Quantify the Ranking of Arabic Journals and Research Output,2012,Puse,positive
BasePaper,2012_53_8,Response to Sasso L (2011) Commentary on Thompson DR & Watson R (2010) Guest editorial: h?indexes and the performance of nursing professors of nursing in the …,2012,Puse,positive
BasePaper,2012_25_6,Calibration against a reference set: A quantitative approach to assessment of the methods of assessment of scientific output,2012,Puse,positive
BasePaper,2012_28_6,The Journal's Integrated Impact Index: a new indicator for journal evaluation,2012,Puse,positive
BasePaper,2012_41_9,Deployment and operational aspects of rural broadband wireless access networks,2012,Puse,positive
BasePaper,2012_16_7,Analytics for understanding research,2012,Puse,positive
BasePaper,2012_9_8,"Exploring the nonlinear effects of patent H index, patent citations, and essential technological strength on corporate performance by using artificial neural network",2012,Puse,positive
BasePaper,2012_36_4,Language model for the joint scheduling of relevant entities in a heterogeneous information network,2012,Puse,positive
BasePaper,2012_11_1,Discovery of factors influencing citation impact based on a soft fuzzy rough set model,2012,Puse,positive
BasePaper,2012_7_5,There is no deadline: time evolution of Wikipedia discussions,2012,Puse,positive
BasePaper,2012_17_8,Trends in literature on new oilseed crops and related species: Seeking evidence of increasing or waning interest,2012,Puse,positive
BasePaper,2012_18_4,Basic independence axioms for the publication-citation system,2012,Puse,positive
BasePaper,2012_46_5,Amasya University Turkey,2012,Puse,positive
BasePaper,2012_10_6,Recommendation on academic networks using direction aware citation analysis,2012,Puse,positive
BasePaper,2012_10_1,Open access and online publishing: a new frontier in nursing?,2012,Puse,negative
BasePaper,2012_7_3,A trust-based social recommender for teachers,2012,Puse,negative
BasePaper,2012_48_7,Citations to Australian Astronomy: 5-and 10-Year Benchmarks,2012,Puse,positive
BasePaper,2012_6_2,The case of scientometricians with the “absolute relative” impact indicator,2012,Puse,positive
BasePaper,2012_27_6,Indices to quantify arabic journal ranks and research output,2012,Puse,positive
BasePaper,2012_52_9,CiteSearcher: A Google Scholar frontend for Mobile Devices,2012,Puse,negative
BasePaper,2012_52_7,EVALUATION OF ACADEMIC IMPACT,2012,Puse,negative
BasePaper,2012_51_2,China's Emergence as a Leading Country in Artificial Intelligence-From a Bibliometric View,2012,Puse,negative
BasePaper,2012_1_8,Exploring the relation between family involvement and firms' financial performance: A meta-analysis of main and moderator effects,2012,Puse,neutral
BasePaper,2012_25_1,On the relation between effort-dominating and symmetric minitive aggregation operators,2012,Puse,positive
BasePaper,2012_57_7,INSTITUTO SUPERIOR DE TECNOLOGÍAS Y CIENCIAS APLICADAS,2012,Puse,positive
BasePaper,2012_39_5,Information systems for enhancing social experience in a conference context: A sensor based approach,2012,Puse,positive
BasePaper,2012_60_10,Valutazione della ricerca tramite indicatori bibliometrici e ranking degli Atenei,2012,Puse,positive
BasePaper,2012_21_10,Exploration and visualization of administrator network in wikipedia,2012,Puse,positive
BasePaper,2012_39_2,Proposal of an individual scientometric index with emphasis on ponderation of the effective contribution of the first author: h-fac índex,2012,Puse,positive
BasePaper,2012_25_7,The five top bad reasons nurses don't publish in impactful journals,2012,Puse,positive
BasePaper,2012_4_7,Counting citations in the field of business and management: Why use Google Scholar rather than the Web of Science,2012,Puse,positive
BasePaper,2012_14_3,"Citation measures at the micro level: Influence of publication age, field, and uncitedness",2012,Puse,negative
BasePaper,2012_47_2,The Production of Scientific Output by Early-Career Researchers,2012,Puse,neutral
BasePaper,2012_47_4,A computational trust model for collaborative ventures,2012,Puse,neutral
BasePaper,2012_5_9,Measuring academic performance for healthcare researchers with the H index: which search tool should be used?,2012,Puse,positive
BasePaper,2012_51_5,A prominent approach to determine the excellence of students E-Dissertation using h-index and UCINET,2012,Puse,positive
BasePaper,2012_29_5,On the age-independent publication index,2012,Puse,neutral
BasePaper,2012_52_8,The h?index beats the impact factor,2012,Puse,neutral
BasePaper,2012_29_3,Predicting the prominence of scholarship for prolific communication scholars,2012,Puse,neutral
BasePaper,2012_52_5,Proposal of an individual scientometric index with emphasis on ponderation of the effective contribution of the first author: h-fac índex,2012,Puse,positive
BasePaper,2012_4_1,Evidence-based medicine versus personalized medicine: are they enemies?,2012,Puse,positive
BasePaper,2012_11_9,An evaluation of forestry journals using bibliometric indices,2012,Puse,negative
BasePaper,2012_12_6,A Survey of impact and citation indices: Limitations and issues,2012,Puse,negative
BasePaper,2012_6_8,Google Scholar Metrics for Publications: The software and content features of a new open access bibliometric service,2012,Puse,positive
BasePaper,2012_7_1,Knowledge epidemics and population dynamics models for describing idea diffusion,2012,Puse,positive
BasePaper,2012_35_8,Academic inbreeding and research productivity in Australian law schools,2012,Puse,positive
BasePaper,2012_2_10,A reverse engineering approach to the suppression of citation biases reveals universal properties of citation distributions,2012,Puse,negative
BasePaper,2012_9_6,Relative measure index: a metric to measure the quality of journals,2012,Puse,negative
BasePaper,2012_59_1,Número completo,2012,Puse,positive
BasePaper,2012_46_9,RANKING CHEMISTRY JOURNALS USING THE HIRSCH INDEX AND ARTICLE INFLUENCE SCORE,2012,Puse,neutral
BasePaper,2012_33_10,European research in the field of production technology and manufacturing systems: an exploratory analysis through publications and patents,2012,Puse,neutral
BasePaper,2012_40_2,Comments on “A publication index that is independent of age” by Abt,2012,Puse,positive
BasePaper,2012_4_4,Bibliometric methods for detecting and analysing emerging research topics,2012,Puse,neutral
BasePaper,2012_7_7,“3.. 2.. 1.. Impact [Factor]: Target [Academic Career] Destroyed!” Just Another Statistical Casualty,2012,Puse,positive
BasePaper,2012_53_5,Scientometric performance indicators and bounds and inequalities,2012,Puse,positive
BasePaper,2012_55_3,Knowledge and know-how: a new model of academic freedom and dissent in non-democratic countries,2012,Puse,positive
BasePaper,2012_26_2,"Knowledge network for authoring, reviewing, editing, searching, and using scientific or other credible information",2012,Puse,positive
BasePaper,2012_16_1,"99 entrepreneurship journals: A comparative empirical investigation of rankings, impact, and H/HC-index",2012,Puse,positive
BasePaper,2012_14_2,Some limitations of the h index: A commentary on Ruscio and colleagues' analysis of bibliometric indices,2012,Puse,positive
BasePaper,2012_8_9,Aggregating different paper quality measures with a generalized h-index,2012,Puse,positive
BasePaper,2012_18_1,An Internet measure of the value of citations,2012,Puse,neutral
BasePaper,2012_48_9,Two New Simple Bibliometric Indexes to Better Evaluate Research in Economics,2012,Puse,positive
BasePaper,2012_13_9,Research evaluation. Part I: productivity and citedness of a German medical research institution,2012,Puse,neutral
BasePaper,2012_1_4,The inconsistency of the h?index,2012,Puse,positive
BasePaper,2012_36_1,Unraveling issues behind ISI misconceptions: An empirical study on the practical effects of academic publication,2012,Puse,neutral
BasePaper,2012_24_6_co1,Ranking scientific publications using a model of network traffic,2012,neutral,neutral
BasePaper,2012_23_6_co1,Irreproducible results: a response to Thomson Scientific,2012,neutral,neutral
BasePaper,2012_24_6_co3,An improvement of the h-index: The g-index,2012,neutral,neutral
2012_10_10,2012_7_2,,2012,,
2012_10_2,2012_7_2,,2012,,
2012_10_3,2012_7_2,,2012,,
2012_10_4,2012_7_2,,2012,,
2012_10_6,2012_3_10,,2012,,
2012_10_7,2012_7_2,,2012,,
2012_10_9,2012_7_2,,2012,,
2012_11_1,2012_7_2,,2012,,
2012_11_10,2012_7_2,,2012,,
2012_11_4,2012_7_2,,2012,,
2012_11_5,2012_3_10,,2012,,
2012_11_5,2012_7_2,,2012,,
2012_11_6,2012_7_2,,2012,,
2012_11_7,2012_47_9,,2012,,
2012_11_7,2012_7_2,,2012,,
2012_11_8,2012_7_2,,2012,,
2012_11_9,2012_3_10,,2012,,
2012_11_9,2012_7_2,,2012,,
2012_12_2,2012_7_2,,2012,,
2012_12_5,2012_7_2,,2012,,
2012_12_6,2012_3_10,,2012,,
2012_12_6,2012_7_2,,2012,,
2012_12_7,2012_7_2,,2012,,
2012_12_9,2012_7_2,,2012,,
2012_13_1,2012_7_2,,2012,,
2012_13_10,2012_7_2,,2012,,
2012_13_2,2012_7_2,,2012,,
2012_13_3,2012_7_2,,2012,,
2012_13_4,2012_3_10,,2012,,
2012_13_4,2012_7_2,,2012,,
2012_13_5,2012_7_2,,2012,,
2012_13_6,2012_7_2,,2012,,
2012_13_9,2012_7_2,,2012,,
2012_14_1,2012_7_2,,2012,,
2012_14_2,2012_7_2,,2012,,
2012_14_3,2012_3_10,,2012,,
2012_14_3,2012_7_2,,2012,,
2012_14_4,2012_3_10,,2012,,
2012_14_4,2012_7_2,,2012,,
2012_14_5,2012_7_2,,2012,,
2012_15_1,2012_7_2,,2012,,
2012_15_10,2012_7_2,,2012,,
2012_15_2,2012_7_2,,2012,,
2012_15_3,2012_7_2,,2012,,
2012_15_7,2012_7_2,,2012,,
2012_16_2,2012_7_2,,2012,,
2012_16_5,2012_7_2,,2012,,
2012_16_6,2012_3_10,,2012,,
2012_16_6,2012_7_2,,2012,,
2012_16_7,2012_7_2,,2012,,
2012_16_8,2012_7_2,,2012,,
2012_16_9,2012_7_2,,2012,,
2012_17_10,2012_7_2,,2012,,
2012_17_3,2012_7_2,,2012,,
2012_17_4,2012_7_2,,2012,,
2012_17_6,2012_7_2,,2012,,
2012_17_7,2012_7_2,,2012,,
2012_17_8,2012_7_2,,2012,,
2012_17_9,2012_7_2,,2012,,
2012_18_1,2012_3_10,,2012,,
2012_18_1,2012_7_2,,2012,,
2012_18_2,2012_7_2,,2012,,
2012_18_3,2012_7_2,,2012,,
2012_18_4,2012_7_2,,2012,,
2012_18_7,2012_7_2,,2012,,
2012_18_8,2012_7_2,,2012,,
2012_18_9,2012_7_2,,2012,,
2012_19_1,2012_7_2,,2012,,
2012_19_10,2012_7_2,,2012,,
2012_19_3,2012_7_2,,2012,,
2012_19_4,2012_7_2,,2012,,
2012_19_7,2012_7_2,,2012,,
2012_19_9,2012_7_2,,2012,,
2012_1_10,2012_7_2,,2012,,
2012_1_3,2012_7_2,,2012,,
2012_1_4,2012_7_2,,2012,,
2012_1_7,2012_7_2,,2012,,
2012_1_9,2012_7_2,,2012,,
2012_20_1,2012_3_10,,2012,,
2012_20_1,2012_7_2,,2012,,
2012_20_2,2012_7_2,,2012,,
2012_20_3,2012_7_2,,2012,,
2012_20_4,2012_7_2,,2012,,
2012_20_6,2012_3_10,,2012,,
2012_20_6,2012_7_2,,2012,,
2012_20_7,2012_7_2,,2012,,
2012_20_8,2012_7_2,,2012,,
2012_20_9,2012_3_10,,2012,,
2012_20_9,2012_7_2,,2012,,
2012_21_1,2012_3_10,,2012,,
2012_21_1,2012_7_2,,2012,,
2012_21_10,2012_3_10,,2012,,
2012_21_10,2012_7_2,,2012,,
2012_21_8,2012_7_2,,2012,,
2012_21_9,2012_3_10,,2012,,
2012_21_9,2012_7_2,,2012,,
2012_22_1,2012_7_2,,2012,,
2012_22_2,2012_7_2,,2012,,
2012_22_4,2012_7_2,,2012,,
2012_22_6,2012_7_2,,2012,,
2012_22_9,2012_7_2,,2012,,
2012_23_1,2012_7_2,,2012,,
2012_23_2,2012_7_2,,2012,,
2012_23_3,2012_7_2,,2012,,
2012_23_4,2012_7_2,,2012,,
2012_23_5,2012_3_10,,2012,,
2012_23_5,2012_7_2,,2012,,
2012_23_6,2012_7_2,,2012,,
2012_24_3,2012_7_2,,2012,,
2012_24_5,2012_7_2,,2012,,
2012_24_6,2012_7_2,,2012,,
2012_24_6_co1,2012_3_10,,2012,,
2012_24_6_co3,2012_7_2,,2012,,
2012_24_7,2012_7_2,,2012,,
2012_24_8,2012_7_2,,2012,,
2012_24_9,2012_7_2,,2012,,
2012_25_1,2012_15_1,,2012,,
2012_25_1,2012_7_2,,2012,,
2012_25_10,2012_7_2,,2012,,
2012_25_2,2012_7_2,,2012,,
2012_25_4,2012_7_2,,2012,,
2012_25_5,2012_7_2,,2012,,
2012_25_6,2012_7_2,,2012,,
2012_25_7,2012_7_2,,2012,,
2012_25_8,2012_7_2,,2012,,
2012_26_3,2012_7_2,,2012,,
2012_26_4,2012_7_2,,2012,,
2012_26_5,2012_7_2,,2012,,
2012_26_6,2012_7_2,,2012,,
2012_26_7,2012_40_4,,2012,,
2012_26_7,2012_7_2,,2012,,
2012_26_8,2012_7_2,,2012,,
2012_26_9,2012_3_10,,2012,,
2012_26_9,2012_7_2,,2012,,
2012_27_6,2012_7_2,,2012,,
2012_27_7,2012_7_2,,2012,,
2012_27_8,2012_7_2,,2012,,
2012_27_9,2012_7_2,,2012,,
2012_28_1,2012_7_2,,2012,,
2012_28_10,2012_3_10,,2012,,
2012_28_10,2012_7_2,,2012,,
2012_28_2,2012_3_10,,2012,,
2012_28_2,2012_7_2,,2012,,
2012_28_4,2012_7_2,,2012,,
