Source,Target,Title,Year,Rhetorics,
BasePaper,BasePaper,An index to quantify an individual's scientific research output,2012,--,--
BasePaper,2012_33_8,Impact of the number of dermatologists on dermatology biomedical research: a Canadian study,2012,Puse,positive
BasePaper,2012_9_3,"Assessing the scientific productivity of Italian forest researchers using the Web of Science, SCOPUS and SCIMAGO databases",2012,Puse,positive
BasePaper,2012_41_4,A Context and Content Reflection on Business-IT Alignment Research,2012,Puse,neutral
BasePaper,2012_15_7,Scientific productivity of OECD countries in dermatology journals within the last 10?year period,2012,Puse,neutral
BasePaper,2012_8_7,Exploiting web querying for web people search,2012,Puse,negative
BasePaper,2012_15_2,Scientific production and citation impact: a bibliometric analysis in acupuncture over three decades,2012,Puse,positive
BasePaper,2012_46_4,Impact Factors: the grand delusion,2012,Puse,neutral
BasePaper,2012_15_8,The World Bank's publication record,2012,Puse,negative
BasePaper,2012_25_9,Legends of the field: Influential scholars in multicultural counseling,2012,Puse,positive
BasePaper,2012_33_9,What Should JOBM Be When It Grows Up?,2012,Puse,positive
BasePaper,2012_24_4,A quantile approach to integration with respect to non-additive measures,2012,Puse,positive
BasePaper,2012_42_2,VOXSUP: a social engagement framework,2012,Puse,positive
BasePaper,2012_20_5,"Reply to Chitnis and Smith, Fernandes, Gibbons, and Kane: Communicating theory effectively requires more explanation, not fewer equations",2012,Puse,positive
BasePaper,2012_41_3,Research Trends of Mechanism and Machine Theory Using Bibliometrics,2012,Puse,positive
BasePaper,2012_23_4,Quality & Quantity journal: a bibliometric snapshot,2012,Puse,positive
BasePaper,2012_40_4,Extra credit,2012,Puse,negative
BasePaper,2012_15_4,Use and misuse of the impact factor,2012,Puse,positive
BasePaper,2012_51_7,"Author-Level Eigenfactor Metrics: Evaluating the influence of authors, institutions and countries within the SSRN community",2012,Puse,positive
BasePaper,2012_26_9,Computing scientometrics in large-scale academic search engines with mapreduce,2012,Puse,positive
BasePaper,2012_16_2,Publication patterns of award-winning forest scientists and implications for the Australian ERA journal ranking,2012,Puse,neutral
BasePaper,2012_50_9,Scientific Publication in Software Engineering,2012,Puse,neutral
BasePaper,2012_35_10,Food for thought: Comparison of citations received from articles appearing in specialized eating disorder journals versus general psychiatry journals,2012,Puse,positive
BasePaper,2012_54_7,The h-and a-Indexes in Astronomy,2012,Puse,neutral
BasePaper,2012_12_10,Revised h index for biomedical research,2012,Puse,positive
BasePaper,2012_5_8,Trends in science networks: understanding structures and statistics of scientific networks,2012,Puse,negative
BasePaper,2012_54_3,A Hyperlink-based Model for the Management of Teaching Documents in a University Centre,2012,Puse,positive
BasePaper,2012_4_2,"Impact factors, scientometrics and the history of citation-based research",2012,Puse,positive
BasePaper,2012_24_5,A Review of the Journal of Investigative Dermatology's Most Cited Publications over the Past 25 Years and the Use of Developing Bibliometric Methodologies  …,2012,Puse,positive
BasePaper,2012_22_7,Instant social graph search,2012,Puse,positive
BasePaper,2012_41_8,Medical Journalism,2012,Puse,positive
BasePaper,2012_33_6,Helping communication programs represent their strengths: Toward an endogenous measure of article publication productivity in communication serials,2012,Puse,negative
BasePaper,2012_4_10,The success-index: an alternative approach to the h-index for evaluating an individual's research output,2012,Puse,positive
BasePaper,2012_22_1,Scale-Independent Measures: Theory and Practice,2012,Puse,positive
BasePaper,2012_42_5,Chemistry databases of the scientific and technical network STN International,2012,Puse,positive
BasePaper,2012_18_8,Digital Scholarship and the tenure process as an indicator of change in Universities,2012,Puse,positive
BasePaper,2012_26_5,Mining research abstracts for exploration of research communities,2012,Puse,negative
BasePaper,2012_23_6,A 10-year performance trajectory of top nutrition journals' impact factors,2012,Puse,positive
BasePaper,2012_12_1,Gender trends of urology manuscript authors in the United States: a 35-year progression,2012,Puse,positive
BasePaper,2012_34_7,Australasian Plant Pathology: an analysis of authorship and citations in the 21st century,2012,Puse,positive
BasePaper,2012_15_1,The stochastic h-index,2012,Puse,positive
BasePaper,2012_48_2,NEW METRICS FOR RESEARCH OUTPUTS FROM THE CHEMISTRY DEPARTMENT IN VALAHIA UNIVERSITY OF TARGOVISTE,2012,Puse,positive
BasePaper,2012_28_4,Impact Factor and other metrics for evaluating science: essentials for public health practitioners.,2012,Puse,positive
BasePaper,2012_16_8,"A comment to the papers by Opthof and Leydesdorff, Scientometrics, 88, 1011–1016, 2011 and Waltman et al., Scientometrics, 88, 1017–1022, 2011",2012,Puse,positive
BasePaper,2012_17_6,The citation merit of scientific publications,2012,Puse,neutral
BasePaper,2012_51_8,Ranking of Research Output of Spanish Universities on the Basis of the Multidimensional Prestige of Influential Fields of Study,2012,Puse,positive
BasePaper,2012_54_5,COCOON CORE: CO-?author REcommendations based on Betweenness Centrality and Interest Similarity,2012,Puse,positive
BasePaper,2012_28_8,Short term impact of the Chilean Journal of Agricultural Research: a bibliometric analysis,2012,Puse,positive
BasePaper,2012_39_4,Comparison of the citation distribution and h-index between groups of different sizes,2012,Puse,neutral
BasePaper,2012_39_3,"Impact Factor, Citation Index, H-Index: are researchers still free to choose where and how to publish their results?",2012,Puse,neutral
BasePaper,2012_24_9,Theoretical Analisis of Empirical Relationships for Pareto-Distributed Scientometric Data,2012,Puse,neutral
BasePaper,2012_40_8,Building research capacity in resource limited countries,2012,Puse,positive
BasePaper,2012_17_3,"Comparison of ISI web of knowledge, SCOPUS, and Google Scholar h-indices of Iranian nuclear medicine scientists",2012,Puse,neutral
BasePaper,2012_49_7,Measuring concentration in economic sectors by h-index and g-index,2012,Puse,positive
BasePaper,2012_33_5,V-index: a novel metric to measure virtuosity of academics,2012,Puse,positive
BasePaper,2012_2_9,"Coverage of Google Scholar, Scopus, and Web of Science: A case study of the h-index in nursing",2012,Puse,neutral
BasePaper,2012_22_3,Quality indicators of scientific research,2012,Puse,positive
BasePaper,2012_3_2,Testing the fairness of citation indicators for comparison across scientific domains: The case of fractional citation counts,2012,Puse,positive
BasePaper,2012_26_4,Scientometric analysis of container terminals and ports literature and interaction with publications on distribution networks,2012,Puse,positive
BasePaper,2012_53_2,Introduction to Journal Impact Factor and h-index: Influence and relevance to contemporary scientific publishing and scholastic achievements,2012,Puse,positive
BasePaper,2012_47_10,Open Access: The Nex t Revolution in Scholarly Publishing,2012,Puse,positive
BasePaper,2012_36_2,The thermodynamics-bibliometrics consilience and the mean of h-type indices-reply,2012,Puse,negative
BasePaper,2012_40_6,Walter R. Nord and Ann F. Connell: Rethinking the knowledge controversy in organization studies: A generative uncertainty perspective,2012,Puse,positive
BasePaper,2012_13_7,The impact of 10 years of war on combat casualty care research: a citation analysis,2012,Puse,positive
BasePaper,2012_49_4,Research on the Comparability of Multi-attribute Evaluation Methods for Academic Journals,2012,Puse,neutral
BasePaper,2012_6_4,A note on the ITS topic evolution in the period 2000–2009 at T-ITS,2012,Puse,positive
BasePaper,2012_55_5,"Survey of the research activity, skills and training needs of Health and Social Care professionals in Ireland",2012,Puse,positive
BasePaper,2012_25_2,Reference classes: a tool for benchmarking universities' research,2012,Puse,neutral
BasePaper,2012_11_10,To be or not to be cited in computer science,2012,Puse,positive
BasePaper,2012_24_3,D-INDEX: a web environment for analyzing dependences among scientific collaborators,2012,Puse,positive
BasePaper,2012_35_4,Further clarifications about the success-index,2012,Puse,positive
BasePaper,2012_2_4,"Egocentric analysis of co-authorship network structure, position and performance",2012,Puse,positive
BasePaper,2012_33_3,Scientific Productivity of Zahedan University of Medical Sciences,2012,Puse,positive
BasePaper,2012_8_3,The role of core documents in bibliometric network analysis and their relation with h-type indices,2012,Puse,negative
BasePaper,2012_34_5,Locating the key competitors: A new tool for technology manager,2012,Puse,positive
BasePaper,2012_7_10,A boosted-trees method for name disambiguation,2012,Puse,positive
BasePaper,2012_34_9,Bibliometric analysis of business and economics in the web of science,2012,Puse,positive
BasePaper,2012_6_1,Positive and negative aspects of citation indices and journal impact factors,2012,Puse,positive
BasePaper,2012_34_8,Drowning in the data deluge,2012,Puse,positive
BasePaper,2012_17_10,Total influence and mainstream measures for scientific researchers,2012,Puse,neutral
BasePaper,2012_24_6,BibRank: a language-based model for co-ranking entities in bibliographic networks,2012,Puse,positive
BasePaper,2012_47_9,Researcher Productivity,2012,Puse,positive
BasePaper,2012_54_8,Bridging the Gap: A Reflection on an Interdisciplinary Approach to Social Media Research,2012,Puse,positive
BasePaper,2012_12_2,A conceptual snapshot of the first decade (2002–2011) of the international journal of information technology & decision making,2012,Puse,positive
BasePaper,2012_9_7,South African universities in world rankings,2012,Puse,negative
BasePaper,2012_13_1,Criminology and criminal justice hit parade: Measuring academic productivity in the discipline,2012,Puse,positive
BasePaper,2012_57_1,La producción académica digital y el proceso de obtención de la titularidad académica como indicador del cambio en las universidades,2012,Puse,positive
BasePaper,2012_3_10,Citation networks,2012,Puse,positive
BasePaper,2012_2_2,"Scholarly network similarities: How bibliographic coupling networks, citation networks, cocitation networks, topical networks, coauthorship networks, and coword  …",2012,Puse,positive
BasePaper,2012_53_9,The Objectivity of National Research Foundation Peer Review Based Ratings in South Africa,2012,Puse,negative
BasePaper,2012_24_7,Examination of the impact of animal and dairy science journals based on traditional and newly developed bibliometric indices,2012,Puse,positive
BasePaper,2012_34_2,Compliance costs caused by agency action? Empirical evidence and implications for tax compliance,2012,Puse,positive
BasePaper,2012_1_5,Future impact: Predicting scientific success,2012,Puse,negative
BasePaper,2012_35_2,An adaptive approach for identifying reputation of researchers,2012,Puse,positive
BasePaper,2012_28_7,The Journal of Computer-Aided Molecular Design: a bibliometric note,2012,Puse,positive
BasePaper,2012_7_8,Measuring the surgical academic output of an institution: the “institutional” H-index,2012,Puse,neutral
BasePaper,2012_7_2,Scientometrics,2012,Puse,positive
BasePaper,2012_21_1,Distributive h?indices for measuring multilevel impact,2012,Puse,neutral
BasePaper,2012_51_6,"Effects of aging, and other bad behaviors",2012,Puse,negative
BasePaper,2012_54_10,"Leonidas Akritidis, Dimitrios Katsaros &",2012,Puse,positive
BasePaper,2012_47_8,DEM Working Paper Series,2012,Puse,positive
BasePaper,2012_4_8,Reputation and earnings: the roles of quality and quantity in academe,2012,Puse,negative
BasePaper,2012_5_6,Impact of self-citation on the H index in the field of academic radiology,2012,Puse,positive
BasePaper,2012_55_1,A Fuzzy Method for the Assessment of the Scientific Production,2012,Puse,positive
BasePaper,2012_45_9,Qualitative Assessment of Research done at Two Premier Medical Institutes in India: Some Data for Introspection,2012,Puse,neutral
BasePaper,2012_16_3,The relative significance of the H-index,2012,Puse,positive
BasePaper,2012_5_5,Distribution of the h-index in radiation oncology conforms to a variation of power law: implications for assessing academic productivity,2012,Puse,positive
BasePaper,2012_10_2,Research status and trends in limnology journals: a bibliometric analysis based on SCI database,2012,Puse,positive
BasePaper,2012_28_2,h-index and m-quotient benchmarks of scholarly impact in criminology and criminal justice: A preliminary note,2012,Puse,positive
BasePaper,2012_8_1,Towards an effective and unbiased ranking of scientific literature through mutual reinforcement,2012,Puse,positive
BasePaper,2012_39_8,A Bibliometric Analysis of Articles Sponsored by NOAA's Office of Ocean Exploration and Research,2012,Puse,positive
BasePaper,2012_48_10,"Transparency, Quality and Accountability",2012,Puse,positive
BasePaper,2012_48_1,Ecology and eScience,2012,Puse,positive
BasePaper,2012_14_5,Counting highly cited papers for university research assessment: conceptual and technical issues,2012,Puse,positive
BasePaper,2012_11_8,Citation analysis of the contact lens field,2012,Puse,neutral
BasePaper,2012_50_3,Bibliographic Metadata Harvesting to Support the Management of an Institutional Repository,2012,Puse,negative
BasePaper,2012_22_8,Nanotechnology research among some leading OIC member states,2012,Puse,negative
BasePaper,2012_51_10,Collaboration and Technology,2012,Puse,positive
BasePaper,2012_19_7,"Scientific communication is down at the moment, please check again later",2012,Puse,positive
BasePaper,2012_1_2,"Data matching: concepts and techniques for record linkage, entity resolution, and duplicate detection",2012,Puse,positive
BasePaper,2012_45_2,Paradigmatic plurality or citation market? A longue durée perspective of management writing,2012,Puse,positive
BasePaper,2012_7_9,Grim tales about the impact factor and the h-index in the Web of Science and the Journal Citation Reports databases: Reflections on Vanclay's criticism,2012,Puse,positive
BasePaper,2012_22_2,Ranking political science departments: The case of Romania,2012,Puse,positive
BasePaper,2012_20_2,Thoughts and facts on bibliometric indicators,2012,Puse,positive
BasePaper,2012_51_4,The h-index in Elsevier's Scopus as an indicator of research achievement for young Malaysian scientists,2012,Puse,negative
BasePaper,2012_23_3,Development a case-based classifier for predicting highly cited papers,2012,Puse,positive
BasePaper,2012_57_3,Education Research in Ibero-America: between Measuring and Invisibility,2012,Puse,neutral
BasePaper,2012_3_9,Impact of fellowship training on research productivity in academic otolaryngology,2012,Puse,positive
BasePaper,2012_1_6,Human-computer interaction: An empirical research perspective,2012,Puse,positive
BasePaper,2012_39_10,S-index: A comprehensive scholar impact index,2012,Puse,negative
BasePaper,2012_1_10,What factors determine citation counts of publications in chemistry besides their quality?,2012,Puse,neutral
BasePaper,2012_59_5,Allergische Rhinitis: Analyse der Forschungstätigkeit (Bibliometrische Untersuchung),2012,Puse,positive
BasePaper,2012_42_1,ACCOMPLISHMENTS OF TOP SCIENCE AND ENGINEERING GRADUATE,2012,Puse,positive
BasePaper,2012_43_9,Knowledge dissemination in the web era,2012,Puse,negative
BasePaper,2012_51_1,Pitfalls of Bibliometrics,2012,Puse,positive
BasePaper,2012_24_8,Online Community User Influence: A Study Using User Status,2012,Puse,positive
BasePaper,2012_39_7,The influence of medical school and residency training program upon choice of an academic career and academic productivity among otolaryngology faculty in the  …,2012,Puse,negative
BasePaper,2012_28_10,Universality in bibliometrics,2012,Puse,positive
BasePaper,2012_49_1,7.15. The h index is the best measure of a scientist's research productivity,2012,Puse,positive
BasePaper,2012_20_10,The 100 most-cited articles in Pediatric Surgery International,2012,Puse,neutral
BasePaper,2012_18_3,What are scientific leaders? The introduction of a normalized impact factor,2012,Puse,positive
BasePaper,2012_19_9,Investigación educacional en Iberoamérica: entre la invisibilidad y la medición,2012,Puse,neutral
BasePaper,2012_19_10,"An outcome evaluation of the national institutes of health (NIH) Director's pioneer award (NDPA) program, FY 2004–2006",2012,Puse,positive
BasePaper,2012_12_7,"The Garfield impact factor, one of the fundamental indicators in scientometrics",2012,Puse,negative
BasePaper,2012_10_7,Modifying h-index by allocating credit of multi-authored papers whose author names rank based on contribution,2012,Puse,positive
BasePaper,2012_46_8,In Pursuit of Performance Assessment in Higher Education: Between Rankings and Institutional Diversity,2012,Puse,positive
BasePaper,2012_11_6,Jazz discometrics–A network approach,2012,Puse,positive
BasePaper,2012_42_6,Playing hide and seek with the European Lower Palaeolithic. A critical re-evaluation of the spatial distribution of sites in Central and Eastern Europe,2012,Puse,positive
BasePaper,2012_49_3,Making Research Count,2012,Puse,positive
BasePaper,2012_20_3,On a possible decomposition of the h?index,2012,Puse,neutral
BasePaper,2012_15_3,Sub-field normalization in the multiplicative case: High-and low-impact citation indicators,2012,Puse,positive
BasePaper,2012_2_1,SciMAT: A new science mapping analysis software tool,2012,Puse,positive
BasePaper,2012_2_7,Four decades of health economics through a bibliometric lens,2012,Puse,positive
BasePaper,2012_10_5,Citation analysis of mental health nursing journals: how should we rank thee?,2012,Puse,neutral
BasePaper,2012_42_3,What do Experts Know About Ranking Journal Quality? A Comparison with ISI Research Impact in Finance,2012,Puse,positive
BasePaper,2012_1_3,Living with the h?index? Metric assemblages in the contemporary academy,2012,Puse,positive
BasePaper,2012_12_8,Pre-residency publication rate strongly predicts future academic radiology potential,2012,Puse,positive
BasePaper,2012_2_8,The possible role of resource requirements and academic career-choice risk on gender differences in publication rate and impact,2012,Puse,positive
BasePaper,2012_5_1,From forensics to forensic science,2012,Puse,positive
BasePaper,2012_18_2,Citation rates for experimental psychology articles published between 1950 and 2004: Top-cited articles in behavioral cognitive psychology,2012,Puse,negative
BasePaper,2012_17_9,Statistical inference on the h-index with an application to top-scientist performance,2012,Puse,positive
BasePaper,2012_17_5,Video digital libraries: contributive and decentralised,2012,Puse,positive
BasePaper,2012_52_3,RESEARCH OUTPUT NEW EVALUATION OF CHEMISTRY GROUP IN VALAHIA UNIVERSITY WITH THE USE OF VARIOUS BIBLIOMETRIC INDICATORS,2012,Puse,positive
BasePaper,2012_55_2,Access to Scientific Information: From Counting to Accountability,2012,Puse,positive
BasePaper,2012_49_5,epop: An eclipse-based extensible research evaluator,2012,Puse,neutral
BasePaper,2012_51_3,"Huibin Du, Linxue Wei, Marilyn",2012,Puse,positive
BasePaper,2012_25_3,Extended dynamic subgraph statistics using h-index parameterized data structures,2012,Puse,neutral
BasePaper,2012_34_6,Comparing engineering departments across institutions: Gathering publication impact data in a short timeframe,2012,Puse,positive
BasePaper,2012_13_5,The Hirsch index of a shifted Lotka function and its relation with the impact factor,2012,Puse,neutral
BasePaper,2012_23_2,Publication and patent analysis of European researchers in the field of production technology and manufacturing systems,2012,Puse,positive
BasePaper,2012_23_1,Citation index and impact factor,2012,Puse,positive
BasePaper,2012_9_1,A measure of total research impact independent of time and discipline,2012,Puse,positive
BasePaper,2012_20_6,The “Science of HRD Research” Reshaping HRD Research Through Scientometrics,2012,Puse,positive
BasePaper,2012_50_8,Research Performance Assessment Based on T-Indicator,2012,Puse,positive
BasePaper,2012_21_9,Identifying attractive research fields for new scientists,2012,Puse,neutral
BasePaper,2012_17_7,Evaluating journal performance metrics,2012,Puse,positive
BasePaper,2012_29_4,Evaluating individual researchers' performance,2012,Puse,negative
BasePaper,2012_22_5,Learning to diversify expert finding with subtopics,2012,Puse,positive
BasePaper,2012_10_3,Costa Rica Publications in the Science Citation Index Expanded:: A bibliometric analysis for 1981-2010,2012,Puse,negative
BasePaper,2012_12_5,Referencing patterns of individual researchers: Do top scientists rely on more extensive information sources?,2012,Puse,positive
BasePaper,2012_26_8,A decade of database conferences: a look inside the program committees,2012,Puse,positive
BasePaper,2012_19_1,Chapter 9 Assessing the impact of online academic videos,2012,Puse,negative
BasePaper,2012_41_7,From Risk Measures to Research Measures,2012,Puse,positive
BasePaper,2012_6_5,"Performance evaluation of research universities in Mainland China, Hong Kong and Taiwan: based on a two-dimensional approach",2012,Puse,positive
BasePaper,2012_29_1,"The H-index: what is it, how do we determine it, and how can we keep up with it",2012,Puse,positive
BasePaper,2012_16_5,Benchmarking citation measures among the Australian education professoriate,2012,Puse,positive
BasePaper,2012_47_5,The Clarion,2012,Puse,positive
BasePaper,2012_1_1,Business intelligence and analytics: From big data to big impact.,2012,Puse,positive
BasePaper,2012_28_9,Someone's loss might be your gain: A case of negative results publications in science,2012,Puse,neutral
BasePaper,2012_27_7,Analysis of academic research performance from publications in the field of Computer Science,2012,Puse,positive
BasePaper,2012_18_7,Mining Google Scholar Citations: An Exploratory Study,2012,Puse,neutral
BasePaper,2012_46_3,Editor's Report for Volume 27 (2010),2012,Puse,neutral
BasePaper,2012_5_10,The physics of spreading ideas,2012,Puse,positive
BasePaper,2012_8_5,Universality of performance indicators based on citation and reference counts,2012,Puse,neutral
BasePaper,2012_13_10,Proposal of square metrics for measuring business process model complexity,2012,Puse,positive
BasePaper,2012_12_4,Who should rank our journals… and based on what?,2012,Puse,positive
BasePaper,2012_49_2,Vascular Malformations of the Orofacial Region,2012,Puse,neutral
BasePaper,2012_25_5,SP-index: The measure of the scientific production of researchers,2012,Puse,positive
BasePaper,2012_17_4,A quantitative analysis of Arctic related articles in the humanities and social sciences appearing in the world core journals,2012,Puse,positive
BasePaper,2012_27_8,Square Complexity Metrics for Business Process Models.,2012,Puse,neutral
BasePaper,2012_4_5,Using the h-index to measure the quality of journals in the field of business and management,2012,Puse,positive
BasePaper,2012_13_8,Prevalence of mixed methods research in mathematics education,2012,Puse,positive
BasePaper,2012_18_10,"On hype, malpractice, and scientific misconduct in organic synthesis",2012,Puse,positive
BasePaper,2012_8_8,Three-feature model to reproduce the topology of citation networks and the effects from authors' visibility on their h-index,2012,Puse,positive
BasePaper,2012_4_6,A critical assessment of the h?index,2012,Puse,positive
BasePaper,2012_45_10,How good is your work? A New Conference Classification Approach for Judging the Quality of a Publication,2012,Puse,positive
BasePaper,2012_54_2,Impacto de Corto Plazo de Chilean Journal of Agricultural Research: Un Análisis Bibliométrico,2012,Puse,positive
BasePaper,2012_5_7,Size-dependent photodegradation of CdS particles deposited onto TiO2 mesoporous films by SILAR method,2012,Puse,positive
BasePaper,2012_7_6,Network model of knowledge diffusion,2012,Puse,positive
BasePaper,2012_46_7,On necessity of the Azerbaijan citation index (AzCI),2012,Puse,positive
BasePaper,2012_39_9,Re-ranking of high-impact AI journals based on h-index,2012,Puse,neutral
BasePaper,2012_4_3,Revisiting the scaling of citations for research assessment,2012,Puse,positive
BasePaper,2012_25_8,Scientific subject categories of Web of Knowledge ranked according to their multidimensional prestige of influential journals,2012,Puse,positive
BasePaper,2012_8_10,Impact factor as a metric to assess journals where OM research is published,2012,Puse,negative
BasePaper,2012_2_6,Global urbanization research from 1991 to 2009: A systematic research review,2012,Puse,positive
BasePaper,2012_33_4,Our first impact factor,2012,Puse,positive
BasePaper,2012_12_9,HistCite analysis of papers constituting the h index research front,2012,Puse,positive
BasePaper,2012_28_5,Sub-field normalization within the IEEE publication galaxy: a novel approach based on the link between journals and Technical Societies,2012,Puse,positive
BasePaper,2012_16_4,Sri Lanka in global medical research: a scientific analysis of the Sri Lankan research output during 2000-2009,2012,Puse,positive
BasePaper,2012_26_6,Dilemma of journal ranking: perplexity regarding research quality,2012,Puse,neutral
BasePaper,2012_46_10,SPRU Electronic Working Paper Number 198,2012,Puse,positive
BasePaper,2012_6_10,Comments on a critique of the Thomson Reuters journal impact factor,2012,Puse,positive
BasePaper,2012_14_4,The proximity of co-citation,2012,Puse,neutral
