Source,Target,Title,Year,Rhetorics,
BasePaper,BasePaper,An index to quantify an individual's scientific research output,2012,--,--
BasePaper,2013_46_8,Problems arising in evaluation of interdisciplinary scientific research for innovation,2013,Puse,positive
BasePaper,2013_12_4,Beyond words: Using nonverbal communication data in research to enhance thick description and interpretation,2013,Puse,positive
BasePaper,2013_9_7,Mining graph topological patterns: Finding covariations among vertex descriptors,2013,Puse,positive
BasePaper,2013_8_2,Influence of baseline left ventricular function on the clinical outcome of surgical ventricular reconstruction in patients with ischaemic cardiomyopathy,2013,Puse,neutral
BasePaper,2013_48_8,Flattening network data for causal discovery: What could go wrong?,2013,Puse,positive
BasePaper,2013_41_8,I Publish in I Edit?-Do Editorial Board Members of Urologic Journals Preferentially Publish Their Own Scientific Work?,2013,Puse,positive
BasePaper,2013_66_3,Comparing Simulations of Pedestrian Motion MPhys Project Report,2013,Puse,negative
BasePaper,2013_27_8,Leveraging social relevance: Using social networks to enhance literature access and microblog search,2013,Puse,positive
BasePaper,2013_60_8,INTERNATIONAL JOURNAL OF PURE AND APPLIED RESEARCH IN ENGINEERING AND TECHNOLOGY,2013,Puse,negative
BasePaper,2013_21_4,Socializing the h-index,2013,Puse,negative
BasePaper,2013_55_4,ICT in Business,2013,Puse,positive
BasePaper,2013_4_1,Gender disparities in research productivity among 9952 academic physicians,2013,Puse,neutral
BasePaper,2013_6_3,C-index: A weighted network node centrality measure for collaboration competence,2013,Puse,positive
BasePaper,2013_18_5,Assessing the accuracy of the h?and g?indexes for measuring researchers' productivity,2013,Puse,positive
BasePaper,2013_34_4,A relational approach to an algebraic community: from paul erd?s to he jifeng,2013,Puse,positive
BasePaper,2013_10_8,The Distribution of the H?index Among Academic Emergency Physicians in the United States,2013,Puse,positive
BasePaper,2013_24_5,Bibliometric indicators: why do we need more than one?,2013,Puse,neutral
BasePaper,2013_4_7,Gender disparity among US anaesthesiologists: are women underrepresented in academic ranks and scholarly productivity?,2013,Puse,neutral
BasePaper,2013_13_3,Arab world,2013,Puse,positive
BasePaper,2013_22_2,The suitability of h and g indexes for measuring the research performance of institutions,2013,Puse,negative
BasePaper,2013_46_6,The role of national university rankings in an international context: The case of the I-UGR Rankings of Spanish Universities,2013,Puse,positive
BasePaper,2013_3_8,On the predictability of future impact in science,2013,Puse,neutral
BasePaper,2013_12_2,A citation-analysis of economic research institutes,2013,Puse,positive
BasePaper,2013_2_2,"One fungus, one name: defining the genus Fusarium in a scientifically robust way that preserves longstanding use",2013,Puse,positive
BasePaper,2013_11_7,Global nanotribology research output (1996–2010): A scientometric analysis,2013,Puse,positive
BasePaper,2013_38_5,Revealing comparative advantages in the backbone of science,2013,Puse,negative
BasePaper,2013_36_8,Der Nutzen informetrischer Analysen und nicht-textueller Dokumentattribute für das Information Retrieval in digitalen Bibliotheken,2013,Puse,positive
BasePaper,2013_27_10,Gender bias and explanation models for the phenomenon of women's discriminations in research careers,2013,Puse,neutral
BasePaper,2013_1_7,Mining heterogeneous information networks: a structural analysis approach,2013,Puse,positive
BasePaper,2013_45_9,Profile and scientific production of Brazilian National Council of Technological and Scientific Development researchers in Pediatrics,2013,Puse,positive
BasePaper,2013_1_5,Leaving theory behind: Why simplistic hypothesis testing is bad for International Relations,2013,Puse,negative
BasePaper,2013_57_1,Assessment of the EPQ probability parameter for scientific articles publishing,2013,Puse,neutral
BasePaper,2013_51_3,An improved method for assessing the impact of management journals,2013,Puse,negative
BasePaper,2013_49_7,Research productivity and fellowship training in neurosurgery,2013,Puse,neutral
BasePaper,2013_10_6,Mapping biofuel field: a bibliometric evaluation of research output,2013,Puse,neutral
BasePaper,2013_11_5,The scholarly impact of CLEF (2000–2009),2013,Puse,positive
BasePaper,2013_14_7,The changing dynamics in citation index publication position China in a race with the USA for global leadership,2013,Puse,positive
BasePaper,2013_1_10,Citation analysis may severely underestimate the impact of clinical research as compared to basic research,2013,Puse,neutral
BasePaper,2013_56_3,Modeling Science using Social Media and Web Data,2013,Puse,positive
BasePaper,2013_49_3,What Affects Citation Counts in MIS Research Articles? An Empirical Investigation,2013,Puse,positive
BasePaper,2013_14_10,Enhancing the h index for the objective assessment of healthcare researcher performance and impact,2013,Puse,positive
BasePaper,2013_39_10,Variability of citation behavior between scientific fields and the normalization problem: The “citing-side” normalization in context,2013,Puse,positive
BasePaper,2013_28_6,Lifting the fog of scientometric research artifacts: On the scientometric analysis of environmental tobacco smoke research,2013,Puse,positive
BasePaper,2013_64_10,H-INDEX OF ASTROPHYSICISTS AT RAMAN RESEARCH INSTITUTE: PERFORMANCE OF DIFFERENT CALCULATORS,2013,Puse,positive
BasePaper,2013_30_8,The excess-tail ratio: correcting journal impact factors for citation distributions,2013,Puse,neutral
BasePaper,2013_67_6,Relative Positions of Countries in the World of Science,2013,Puse,positive
BasePaper,2013_3_3,Is there a relationship between National Institutes of Health funding and research impact on academic urology?,2013,Puse,positive
BasePaper,2013_24_9,"Building on and honoring forty years of PBL scholarship from Howard Barrows: A scientometric, large-scale data, and visualization-based analysis",2013,Puse,positive
BasePaper,2013_39_4,"The global university, the political economy of knowledge in Asia and the segmentation of China's higher education",2013,Puse,positive
BasePaper,2013_65_9,Competence,2013,Puse,positive
BasePaper,2013_13_7,Google Scholar and the h-index in biomedicine: The popularization of bibliometric assessment,2013,Puse,negative
BasePaper,2013_22_8,"OM3: Ordered Maxitive, Minitive, and Modular Aggregation Operators: Axiomatic Analysis under Arity-Dependence (I)",2013,Puse,positive
BasePaper,2013_28_7,Efficiency analysis of forestry journals: Suggestions for improving journals' quality,2013,Puse,positive
BasePaper,2013_11_3,Coauthorship and citation in scientific publishing,2013,Puse,negative
BasePaper,2013_65_4,Scientific Performance of the University of Ruhuna During 1999-2010 Based on the ISI WoS Database: A Scientometric Study,2013,Puse,neutral
BasePaper,2013_16_5,Experimenting with the partnership ability ?-index on a million computer scientists,2013,Puse,positive
BasePaper,2013_12_6,Ranking journal quality by harmonic mean of ranks: An application to ISI Statistics & Probability,2013,Puse,positive
BasePaper,2013_50_4,Data cleaning and matching of institutions in bibliographic databases,2013,Puse,negative
BasePaper,2013_30_1,The h-index: A case of the tail wagging the dog?,2013,Puse,negative
BasePaper,2013_67_1,Study of H-index in Evaluation of Library and Information Science Journals,2013,Puse,positive
BasePaper,2013_64_1,Author Productivity Indexing via Topic Sensitive Weighted Citations,2013,Puse,positive
BasePaper,2013_55_6,Academic Tenure: Correlational evidence of H-index to online social networks,2013,Puse,neutral
BasePaper,2013_10_4,Investigating the current state and impact of the intellectual capital academic discipline,2013,Puse,positive
BasePaper,2013_31_1,Malleable access rights to establish and enable scientific collaboration,2013,Puse,positive
BasePaper,2013_14_8,Scientific evaluation of the scholarly publications,2013,Puse,negative
BasePaper,2013_41_2,Attributes of a surgical chairperson associated with extramural funding of a department of surgery,2013,Puse,positive
BasePaper,2013_4_3,Comparison of plaintiff and defendant expert witness qualification in malpractice litigation in otolaryngology,2013,Puse,neutral
BasePaper,2013_46_10,The generalized Pareto distribution fitted to research outputs of countries,2013,Puse,neutral
BasePaper,2013_5_9,Quantitative evaluation of alternative field normalization procedures,2013,Puse,positive
BasePaper,2013_17_10,Bibliometrics for Internet media: Applying the h?index to YouTube,2013,Puse,positive
BasePaper,2013_18_9,Scientific impact assessment cannot be fair,2013,Puse,positive
BasePaper,2013_28_2,"Bibliometric approach to research assessment: Publication count, citation count, & author rank",2013,Puse,positive
BasePaper,2013_30_9,'Open for business': Do open-access psychiatry journals provide value for money?,2013,Puse,neutral
BasePaper,2013_18_10,Who blogs what: understanding the publishing behavior of bloggers,2013,Puse,neutral
BasePaper,2013_18_6,Integrated risk index of chemical aquatic pollution (IRICAP): case studies in Iberian rivers,2013,Puse,positive
BasePaper,2013_41_1,Scientist rankings: What nurse scientists need to know,2013,Puse,negative
BasePaper,2013_40_8,A pragmatic means for measuring the complexity of source code ensembles,2013,Puse,positive
BasePaper,2013_50_10,"Global forest research, science education and community service positively impacted by a unique Centre of Excellence in Tree Health Biotechnology",2013,Puse,positive
BasePaper,2013_26_1,La manufacture de l'évaluation scientifique,2013,Puse,positive
BasePaper,2013_2_5,Global ranking of knowledge management and intellectual capital academic journals: 2013 update,2013,Puse,positive
BasePaper,2013_18_7,Formulae for the h?index: A lack of robustness in Lotkaian informetrics?,2013,Puse,neutral
BasePaper,2013_22_10,Equal contributions and credit: an emerging trend in the characterization of authorship in major anaesthesia journals during a 10-yr period,2013,Puse,positive
BasePaper,2013_13_6,Measuring co-authors' contribution to an article's visibility,2013,Puse,negative
BasePaper,2013_12_10,Best Evidence in Emergency Medicine (BEEM) rater scores correlate with publications' future citations,2013,Puse,positive
BasePaper,2013_39_8,Analyzing citation frequencies of leading software engineering scholars,2013,Puse,positive
BasePaper,2013_48_7,An agent-based model for the bibliometric h-index,2013,Puse,positive
BasePaper,2013_61_7,Profile and analysis of scientific production of Brazilian researchers in Clinical Neurosciences,2013,Puse,negative
BasePaper,2013_21_2,Capturing and Tracking Performance of Patent Portfolio Using $ h $-Complement Area Centroid,2013,Puse,positive
BasePaper,2013_76_8,Using of scientometric indices for research assessment,2013,Puse,neutral
BasePaper,2013_59_8,World Journal of Pharmaceutical ReseaRch,2013,Puse,positive
BasePaper,2013_7_5,Finding academic experts on a multisensor approach using Shannon's entropy,2013,Puse,positive
BasePaper,2013_32_9,How is HRD doing in research and publications? An assessment of journals by AHRD (2005-2011),2013,Puse,positive
BasePaper,2013_16_3,Hybrid centrality measures for binary and weighted networks,2013,Puse,positive
BasePaper,2013_7_10,Predicting publication success for biologists,2013,Puse,positive
BasePaper,2013_41_5,Is there a correlation between journal impact factor and researchers' performance? A study comprising the fields of clinical nephrology and neurosciences,2013,Puse,positive
BasePaper,2013_19_6,Supply chain management research impact: an evidence-based perspective,2013,Puse,positive
BasePaper,2013_47_6,The intellectual influence of economic journals: quality versus quantity,2013,Puse,positive
BasePaper,2013_9_8,Counting publications and citations: Is more always better?,2013,Puse,positive
BasePaper,2013_47_2,Structural and collaborative properties of team science networks,2013,Puse,positive
BasePaper,2013_16_8,A spatiotemporal scientometrics framework for exploring the citation impact of publications and scientists,2013,Puse,negative
BasePaper,2013_19_3,Measuring and visualizing the stability of biomarker selection techniques,2013,Puse,neutral
BasePaper,2013_39_9,Accounting journals and the ABS Guide: a review of evidence and inference,2013,Puse,positive
BasePaper,2013_8_10,Identifying influential scholars in academic social media platforms,2013,Puse,positive
BasePaper,2013_55_7,"ALGSEER: AN ARCHITECTURE FOR EXTRACTION, INDEXING AND",2013,Puse,neutral
BasePaper,2013_51_5,Benchmarking some Portuguese S&T system research units,2013,Puse,positive
BasePaper,2013_62_7,Does seating location impact voting behavior on Food and Drug Administration advisory committees?,2013,Puse,positive
BasePaper,2013_1_4,Granular computing: perspectives and challenges,2013,Puse,positive
BasePaper,2013_2_7,Fifteen years of grey system theory research: a historical review and bibliometric analysis,2013,Puse,neutral
BasePaper,2013_62_1,The Use of Scientific Inscriptions in Criminology and Criminal Justice Journals: An Analysis of Publication Trends between 1985 and 2009,2013,Puse,positive
BasePaper,2013_28_4,Academic performance indicators for departments of geography in the United States and Canada,2013,Puse,positive
BasePaper,2013_23_5,The top 100 cited articles in essential tremor,2013,Puse,positive
BasePaper,2013_1_9,Mapping of drinking water research: A bibliometric analysis of research output during 1992–2011,2013,Puse,positive
BasePaper,2013_64_9,Discovery Tool: A Framework for Accelerating Academic Collaborations,2013,Puse,positive
BasePaper,2013_58_7,Advances in plastic and cosmetic surgery at home and abroad–A bibliometric analysis,2013,Puse,positive
BasePaper,2013_33_8,Measuring and anticipating the impact of data reuse,2013,Puse,positive
BasePaper,2013_66_7,Ways to Increase Usage and Citation of Your Article,2013,Puse,negative
BasePaper,2013_47_7,A Content Analysis of the “International Journal on Marine Navigation and Safety of Sea Transportation” from 2007 to 2012,2013,Puse,positive
BasePaper,2013_51_9,Collaboration and Technology,2013,Puse,positive
BasePaper,2013_21_6,A local social network approach for research management,2013,Puse,positive
BasePaper,2013_59_1,"A closer look at the Impact Factor (JCR 2012): problems, concerns and actions needed",2013,Puse,positive
BasePaper,2013_4_9,Credit where credit is due? The impact of project contributions and social factors on authorship and inventorship,2013,Puse,neutral
BasePaper,2013_26_7,Identifying transformative scientific research,2013,Puse,neutral
BasePaper,2013_62_4,Energetics of the h-bubble,2013,Puse,positive
BasePaper,2013_64_3,Faster Subband Signal Processing [dsp Tips&Tricks],2013,Puse,positive
BasePaper,2013_51_2,The “Authorship Index”-a simple way to measure an author's contribution to literature,2013,Puse,negative
BasePaper,2013_31_4,Users beware: implications of database errors when assessing the individual research records of ecologists and conservation biologists,2013,Puse,positive
BasePaper,2013_46_7,V-index an index based on consistent researcher productivity,2013,Puse,neutral
BasePaper,2013_7_1,Author Impact Factor: tracking the dynamics of individual scientific impact,2013,Puse,negative
BasePaper,2013_18_2,Comparison of different mathematical functions for the analysis of citation distribution of papers of individual authors,2013,Puse,positive
BasePaper,2013_24_10,Advice to a young researcher: with reminiscences of a life in science,2013,Puse,positive
BasePaper,2013_51_4,Reputation and identity in scholarly networked publics,2013,Puse,negative
BasePaper,2013_49_6,Quantifying published scholarly works of experiential education directors,2013,Puse,positive
BasePaper,2013_13_4,Gout: a critical analysis of scientific development,2013,Puse,positive
BasePaper,2013_28_3,Statistical hypothesis test for the difference between Hirsch indices of two Pareto-distributed random samples,2013,Puse,positive
BasePaper,2013_9_3,A scientometric assessment of research output in nanoscience and nanotechnology: Pakistan perspective,2013,Puse,positive
BasePaper,2013_34_8,Driving forces in researchers mobility,2013,Puse,positive
BasePaper,2013_75_7,On freedom of scientific research,2013,Puse,positive
BasePaper,2013_20_5,Theoretical justification of the central area indices and the central interval indices,2013,Puse,negative
BasePaper,2013_50_6,Serious Research with Great Fun: the Strange Case of Jan Šuspa Lepš (and Other Plant Ecologists),2013,Puse,positive
BasePaper,2013_9_10,"Author?level Eigenfactor metrics: Evaluating the influence of authors, institutions, and countries within the social science research network community",2013,Puse,positive
BasePaper,2013_47_4,Recommending intra-institutional scientific collaboration through coauthorship network visualization,2013,Puse,positive
BasePaper,2013_28_8,Career track of Society of University Surgeons Resident Research Award recipients,2013,Puse,neutral
BasePaper,2013_55_9,Research status and trends in Operations Research and Management Science journals: a bibliometric analysis based on Web of Science database 2001-2012,2013,Puse,positive
BasePaper,2013_14_5,Impact factor of a scientific journal: Is it a measure of quality of research?,2013,Puse,positive
BasePaper,2013_33_4,A Scientometrics Study of Rough Sets in Three Decades.,2013,Puse,positive
BasePaper,2013_2_9,Comparison of scholarly impact among surgical specialties: an examination of 2429 academic surgeons,2013,Puse,positive
BasePaper,2013_32_7,A bibliometric study of literature on celiac disease,2013,Puse,positive
BasePaper,2013_18_4,Scientometric assessment of engineering in Malaysians universities,2013,Puse,positive
BasePaper,2013_9_1,Does it matter which citation tool is used to compare the h-index of a group of highly cited researchers?,2013,Puse,positive
BasePaper,2013_21_9,A bibliometric index based on the complete list of cited publications,2013,Puse,neutral
BasePaper,2013_24_6,Digital scholarship: exploration of strategies and Skills for knowledge creation and dissemination,2013,Puse,positive
BasePaper,2013_17_3,Graph-based informative-sentence selection for opinion summarization,2013,Puse,positive
BasePaper,2013_3_6,The top-cited research works in the Science Citation Index Expanded,2013,Puse,neutral
BasePaper,2013_60_5,A Ranking of Journals for the Health Economist,2013,Puse,negative
BasePaper,2013_29_9,Research Excellence Milestones of BRIC and N-11 countries,2013,Puse,positive
BasePaper,2013_40_5,The elephant in the room: multi-authorship and the assessment of individual researchers,2013,Puse,positive
BasePaper,2013_10_10,Comparison of a citation-based indicator and peer review for absolute and specific measures of research-group excellence,2013,Puse,positive
BasePaper,2013_7_9,"The h'-index, effectively improving the h-index based on the citation distribution",2013,Puse,positive
BasePaper,2013_64_7,Engineering search algorithms for web data,2013,Puse,positive
BasePaper,2013_50_2,A Detection of the Most Influential Documents,2013,Puse,positive
BasePaper,2013_47_3,Temporal study of countries' scientific evolution based on two?dimensional approach,2013,Puse,neutral
BasePaper,2013_3_2,What do I want to be with my PhD? The roles of personal values and structural dynamics in shaping the career interests of recent biomedical science PhD graduates,2013,Puse,negative
BasePaper,2013_17_5,On the use of the h-index in evaluating chemical research,2013,Puse,positive
BasePaper,2013_14_3,Understanding evolution of research themes: a probabilistic generative model for citations,2013,Puse,positive
BasePaper,2013_15_6,"Disparities in publication patterns by gender, race and ethnicity based on a survey of a random sample of authors",2013,Puse,neutral
BasePaper,2013_22_5,Bibliometric analysis of South American research in sports science from 1970 to 2012,2013,Puse,positive
BasePaper,2013_13_8,Axiomatizing the Hirsch index: Quantity and quality disjoined,2013,Puse,positive
BasePaper,2013_7_2,When less is more: Effects of grade skipping on adult STEM productivity among mathematically precocious adolescents.,2013,Puse,positive
BasePaper,2013_59_3,Identifying excellent researchers: A new approach,2013,Puse,positive
BasePaper,2013_18_8,Growth dynamics of citations of cumulative papers of individual authors according to progressive nucleation mechanism: Concept of citation acceleration,2013,Puse,positive
BasePaper,2013_28_9,On the correction of the h-index for career length,2013,Puse,neutral
BasePaper,2013_20_3,Top cited articles in adsorption research using Y-index,2013,Puse,neutral
BasePaper,2013_16_4,Contribution of information and communication technology (ICT) in country's H-index,2013,Puse,positive
BasePaper,2013_58_6,Research performance evaluation and citation in the Arabic countries,2013,Puse,positive
BasePaper,2013_25_5,Impact of funding on scientific output and collaboration: A survey of literature,2013,Puse,neutral
BasePaper,2013_16_2,Incorrect citations give unfair credit to review authors in ecology journals,2013,Puse,positive
BasePaper,2013_29_3,"Correlation between variables subject to an order restriction, with application to scientometric indices",2013,Puse,positive
BasePaper,2013_61_1,"PUBLISHING PERFORMANCE OF COUNTRIES WORLDWIDE IN THE AREA OF DISASTERS, EMERGENCIES, ACCIDENTS ANALYSIS ACCORDING TO  …",2013,Puse,positive
BasePaper,2013_28_5,Reverse-engineering conference rankings: what does it take to make a reputable conference?,2013,Puse,positive
BasePaper,2013_25_7,"India's contribution on"" Guillain-Barre syndrome"": mapping of 40 years research",2013,Puse,neutral
BasePaper,2013_49_8,Social media and citation metrics,2013,Puse,positive
BasePaper,2013_39_2,How authors can maximise the chance of manuscript acceptance and article visibility,2013,Puse,positive
BasePaper,2013_68_8,Change Co,2013,Puse,positive
BasePaper,2013_6_8,Standardizing the evaluation of scientific and academic performance in neurosurgery—critical review of the “h” index and its variants,2013,Puse,negative
BasePaper,2013_68_1,Categorical and Geographical Separation in Science,2013,Puse,positive
BasePaper,2013_30_5,Citation-paper rank distributions and associated scientometric indicators–a survey,2013,Puse,positive
BasePaper,2013_2_10,A coauthorship network analysis of tourism and hospitality research collaboration,2013,Puse,positive
BasePaper,2013_15_7,Author name disambiguation in scientific collaboration and mobility cases,2013,Puse,neutral
BasePaper,2013_47_8,Are you in h?,2013,Puse,positive
BasePaper,2013_59_5,Inferring novel relationships through over-representation analysis of medical subjects in biomedical bibliographies,2013,Puse,neutral
BasePaper,2013_10_3,Individual research performance: A proposal for comparing apples to oranges,2013,Puse,negative
BasePaper,2013_2_4,Is NIH funding predictive of greater research productivity and impact among academic otolaryngologists?,2013,Puse,positive
BasePaper,2013_5_8,Opinion paper: Thoughts and facts on bibliometric indicators,2013,Puse,positive
BasePaper,2013_60_1,Opportunities for and prospects of using citation indices in evaluating the performance of research institution,2013,Puse,positive
BasePaper,2013_63_7,Digital Scholarship: Exploration of Strategies and Skills for Knowledge Creation and Dissemination,2013,Puse,positive
BasePaper,2013_58_4,Sustentabilidade e inovação: uma pesquisa bibliométrica acercadas publicações internacionais,2013,Puse,positive
BasePaper,2013_41_7,The impact factor,2013,Puse,positive
BasePaper,2013_27_1,Research performance of Turkish astronomers in the period of 1980–2010,2013,Puse,neutral
BasePaper,2013_61_5,Journal of Informetrics,2013,Puse,positive
BasePaper,2013_65_7,R-Score: Reputation-based Scoring of Research Groups,2013,Puse,neutral
BasePaper,2013_65_2,Principal parameters affecting R&D exploitation of nanotechnology research: a case for Korea,2013,Puse,positive
BasePaper,2013_1_6,A comparison between two main academic literature collections: Web of Science and Scopus databases,2013,Puse,positive
BasePaper,2013_1_8,The use of the h?index in academic otolaryngology,2013,Puse,positive
BasePaper,2013_57_7,"Impact factor (if) of hospitality, leisure, sports & tourism journals: current trends, overall ranking and temporal stability over a four year period",2013,Puse,positive
BasePaper,2013_23_9,An empirical investigation of the influence of collaboration in Finance on article impact,2013,Puse,positive
BasePaper,2013_25_10,Zum Verhältnis von Spitzenforschung und Politikberatung: Eine empirische Analyse vor dem Hintergrund des Ökonomenstreits,2013,Puse,positive
BasePaper,2013_66_10,Online Community Influence: A Study Using the Hirsch Metric and Social Network Analysis,2013,Puse,positive
BasePaper,2013_63_6,"Publications of Russian scientists in biology, environmental sciences, and ecology in 2002–2011",2013,Puse,negative
BasePaper,2013_20_8,Discovering influential authors in heterogeneous academic networks by a co-ranking method,2013,Puse,negative
BasePaper,2013_56_9,F-Index: A New Index in Citation Analysis,2013,Puse,positive
BasePaper,2013_30_4,Cross-field evaluation of publications of research institutes using their contributions to the fields' MVPs determined by h-index,2013,Puse,positive
BasePaper,2013_40_7,Analysis of various bibliometric indicators for the evaluation of scientific journals and scientists,2013,Puse,positive
BasePaper,2013_63_3,Research publications: Need for Academicians,2013,Puse,positive
